{
  "$schema": "https://json-schema.org/draft/2020-12/schema",
  "title": "skillcard.index output",
  "type": "object",
  "required": ["root", "profile", "total", "valid", "invalid", "skillcards"],
  "properties": {
    "root": { "type": "string", "minLength": 1 },
    "profile": { "type": "string", "enum": ["compat", "anthropic-v1", "openai-codex-v1"] },
    "total": { "type": "integer", "minimum": 0 },
    "valid": { "type": "integer", "minimum": 0 },
    "invalid": { "type": "integer", "minimum": 0 },
    "skillcards": {
      "type": "array",
      "items": {
        "type": "object",
        "required": ["path", "ok", "frontmatter", "errors", "warnings"],
        "properties": {
          "path": { "type": "string", "minLength": 1 },
          "ok": { "type": "boolean" },
          "frontmatter": {
            "type": "object",
            "additionalProperties": { "type": "string" }
          },
          "errors": {
            "type": "array",
            "items": {
              "type": "object",
              "required": ["code", "message"],
              "properties": {
                "code": { "type": "string", "minLength": 1 },
                "message": { "type": "string", "minLength": 1 },
                "line": { "type": "integer", "minimum": 1 }
              },
              "additionalProperties": false
            }
          },
          "warnings": {
            "type": "array",
            "items": {
              "type": "object",
              "required": ["code", "message"],
              "properties": {
                "code": { "type": "string", "minLength": 1 },
                "message": { "type": "string", "minLength": 1 },
                "line": { "type": "integer", "minimum": 1 }
              },
              "additionalProperties": false
            }
          }
        },
        "additionalProperties": false
      }
    }
  },
  "additionalProperties": false
}
